{
  "id": "PM-ASSE-UPDATE",
  "name": "assessment.update",
  "kind": "permission",
  "version": "0.1.0",
  "status": "proposed",
  "owner": "bhavya-core",
  "description": "update assessment",
  "domain": "D03",
  "sourceAdr": "ADR-006",
  "dependsOn": [],
  "upstream": [],
  "downstream": [],
  "related": [],
  "implementation": {
    "status": "not-started",
    "location": "",
    "files": []
  },
  "tests": {
    "status": "none"
  },
  "docs": {
    "status": "none"
  },
  "release": "",
  "automation": "manual",
  "tags": ["permission", "assessment"],
  "metadata": {
    "group": "assessment",
    "action": "update"
  }
}
