{
  "id": "PM-STUD-ENROLL",
  "name": "student.enroll",
  "kind": "permission",
  "version": "0.1.0",
  "status": "proposed",
  "owner": "bhavya-core",
  "description": "enroll student",
  "domain": "D02",
  "sourceAdr": "ADR-006",
  "dependsOn": [],
  "upstream": [],
  "downstream": [],
  "related": [],
  "implementation": {
    "status": "not-started",
    "location": "",
    "files": []
  },
  "tests": {
    "status": "none"
  },
  "docs": {
    "status": "none"
  },
  "release": "",
  "automation": "manual",
  "tags": ["permission", "student"],
  "metadata": {
    "group": "student",
    "action": "enroll"
  }
}
