{
  "id": "D06-C01",
  "name": "Catalog Management",
  "kind": "capability",
  "version": "0.1.0",
  "status": "proposed",
  "owner": "bhavya-core",
  "description": "Manage library catalog of resources",
  "domain": "D06",
  "sourceAdr": "ADR-006",
  "dependsOn": ["D05-C07", "D05-C01"],
  "upstream": [],
  "downstream": ["D06-C02"],
  "related": [],
  "implementation": {
    "status": "not-started",
    "location": "",
    "files": []
  },
  "tests": {
    "status": "none"
  },
  "docs": {
    "status": "none"
  },
  "release": "",
  "automation": "manual",
  "tags": ["library", "catalog"],
  "metadata": {}
}
