{
  "id": "PM-PART-CREATE",
  "name": "partner.create",
  "kind": "permission",
  "version": "0.1.0",
  "status": "proposed",
  "owner": "bhavya-core",
  "description": "create partner",
  "domain": "D20",
  "sourceAdr": "ADR-006",
  "dependsOn": [],
  "upstream": [],
  "downstream": [],
  "related": [],
  "implementation": {
    "status": "not-started",
    "location": "",
    "files": []
  },
  "tests": {
    "status": "none"
  },
  "docs": {
    "status": "none"
  },
  "release": "",
  "automation": "manual",
  "tags": ["permission", "partner"],
  "metadata": {
    "group": "partner",
    "action": "create"
  }
}
