{
  "id": "EV-AI-005",
  "name": "rag.query",
  "kind": "event",
  "version": "0.1.0",
  "status": "proposed",
  "owner": "bhavya-core",
  "description": "RAG query executed",
  "domain": "D16",
  "sourceAdr": "ADR-006",
  "dependsOn": [],
  "upstream": [],
  "downstream": [],
  "related": ["D16-C02"],
  "implementation": {
    "status": "not-started",
    "location": "",
    "files": []
  },
  "tests": {
    "status": "none"
  },
  "docs": {
    "status": "none"
  },
  "release": "",
  "automation": "manual",
  "tags": ["ai"],
  "metadata": {}
}
