{
  "id": "UI-DOC-003",
  "name": "User Guides",
  "kind": "ui-surface",
  "version": "0.1.0",
  "status": "proposed",
  "owner": "bhavya-core",
  "description": "User documentation",
  "domain": "D17",
  "sourceAdr": "ADR-006",
  "dependsOn": [],
  "upstream": [],
  "downstream": [],
  "related": ["D17-C01"],
  "implementation": {
    "status": "not-started",
    "location": "",
    "files": []
  },
  "tests": {
    "status": "none"
  },
  "docs": {
    "status": "none"
  },
  "release": "",
  "automation": "manual",
  "tags": ["app:docs", "engineering"],
  "metadata": {}
}
