{
  "id": "EV-RES-004",
  "name": "paper.published",
  "kind": "event",
  "version": "0.1.0",
  "status": "proposed",
  "owner": "bhavya-core",
  "description": "Paper published",
  "domain": "D04",
  "sourceAdr": "ADR-006",
  "dependsOn": [],
  "upstream": [],
  "downstream": [],
  "related": ["D07-C03"],
  "implementation": {
    "status": "not-started",
    "location": "",
    "files": []
  },
  "tests": {
    "status": "none"
  },
  "docs": {
    "status": "none"
  },
  "release": "",
  "automation": "manual",
  "tags": ["research"],
  "metadata": {}
}
