{
  "id": "PM-CURR-PUBLISH",
  "name": "curriculum.publish",
  "kind": "permission",
  "version": "0.1.0",
  "status": "proposed",
  "owner": "bhavya-core",
  "description": "publish curriculum",
  "domain": "D03",
  "sourceAdr": "ADR-006",
  "dependsOn": [],
  "upstream": [],
  "downstream": [],
  "related": [],
  "implementation": {
    "status": "not-started",
    "location": "",
    "files": []
  },
  "tests": {
    "status": "none"
  },
  "docs": {
    "status": "none"
  },
  "release": "",
  "automation": "manual",
  "tags": ["permission", "curriculum"],
  "metadata": {
    "group": "curriculum",
    "action": "publish"
  }
}
