{
  "id": "PM-COMP-READ",
  "name": "compliance.read",
  "kind": "permission",
  "version": "0.1.0",
  "status": "proposed",
  "owner": "bhavya-core",
  "description": "read compliance",
  "domain": "D13",
  "sourceAdr": "ADR-006",
  "dependsOn": [],
  "upstream": [],
  "downstream": [],
  "related": [],
  "implementation": {
    "status": "not-started",
    "location": "",
    "files": []
  },
  "tests": {
    "status": "none"
  },
  "docs": {
    "status": "none"
  },
  "release": "",
  "automation": "manual",
  "tags": ["permission", "compliance"],
  "metadata": {
    "group": "compliance",
    "action": "read"
  }
}
