{
  "id": "EV-COM-003",
  "name": "violation.detected",
  "kind": "event",
  "version": "0.1.0",
  "status": "proposed",
  "owner": "bhavya-core",
  "description": "Compliance violation detected",
  "domain": "D13",
  "sourceAdr": "ADR-006",
  "dependsOn": [],
  "upstream": [],
  "downstream": [],
  "related": ["D13-C08"],
  "implementation": {
    "status": "not-started",
    "location": "",
    "files": []
  },
  "tests": {
    "status": "none"
  },
  "docs": {
    "status": "none"
  },
  "release": "",
  "automation": "manual",
  "tags": ["compliance"],
  "metadata": {}
}
