{
  "id": "UI-MON-003",
  "name": "Cost Dashboard",
  "kind": "ui-surface",
  "version": "0.1.0",
  "status": "proposed",
  "owner": "bhavya-core",
  "description": "Infrastructure costs",
  "domain": "D15",
  "sourceAdr": "ADR-006",
  "dependsOn": [],
  "upstream": [],
  "downstream": [],
  "related": ["D15-C07"],
  "implementation": {
    "status": "not-started",
    "location": "",
    "files": []
  },
  "tests": {
    "status": "none"
  },
  "docs": {
    "status": "none"
  },
  "release": "",
  "automation": "manual",
  "tags": ["app:monitoring", "infrastructure"],
  "metadata": {}
}
