{
  "id": "EV-ENG-001",
  "name": "deploy.started",
  "kind": "event",
  "version": "0.1.0",
  "status": "proposed",
  "owner": "bhavya-core",
  "description": "Deployment started",
  "domain": "D17",
  "sourceAdr": "ADR-006",
  "dependsOn": [],
  "upstream": [],
  "downstream": [],
  "related": ["D17-C06"],
  "implementation": {
    "status": "not-started",
    "location": "",
    "files": []
  },
  "tests": {
    "status": "none"
  },
  "docs": {
    "status": "none"
  },
  "release": "",
  "automation": "manual",
  "tags": ["engineering"],
  "metadata": {}
}
