{
  "id": "D15-C02",
  "name": "CI/CD Pipeline",
  "kind": "capability",
  "version": "0.1.0",
  "status": "proposed",
  "owner": "bhavya-core",
  "description": "Continuous integration and deployment",
  "domain": "D15",
  "sourceAdr": "ADR-006",
  "dependsOn": ["D15-C01"],
  "upstream": [],
  "downstream": ["D15-C04"],
  "related": [],
  "implementation": {
    "status": "not-started",
    "location": "",
    "files": []
  },
  "tests": {
    "status": "none"
  },
  "docs": {
    "status": "none"
  },
  "release": "",
  "automation": "manual",
  "tags": ["infra", "cicd"],
  "metadata": {}
}
